{
  "eventId": "01a04dae-1f04-7a3b-9c62-4e8d1a05b7f2",
  "eventType": "order.cancelled",
  "schemaVersion": 1,
  "occurredAt": "2026-08-29T13:41:52.077Z",
  "producer": "order-service",
  "partitionKey": "01a04dad-80da-7c11-b3d2-5a9e1f04a7c3",
  "traceId": "9f2c1e77a4b8d035c6e1904f2ab7c58d",
  "payload": {
    "orderId": "01a04dad-80da-7c11-b3d2-5a9e1f04a7c3",
    "customerId": "01a04dad-80da-70aa-8a07-1444e02c719c",
    "previousStatus": "PLANNED",
    "cancelledAt": "2026-08-29T13:41:52.077Z",
    "reason": "고객 요청"
  }
}
