{
  "eventId": "01a04dad-80da-79a6-95d0-ba4369830bdf",
  "eventType": "order.placed",
  "schemaVersion": 1,
  "occurredAt": "2026-08-29T13:20:11.482Z",
  "producer": "order-service",
  "partitionKey": "01a04dad-80da-7f6e-a63a-e91c103516b0",
  "traceId": "c4474d0fc15e10af509d95cbda4b78b0",
  "payload": {
    "orderId": "01a04dad-80da-7f6e-a63a-e91c103516b0",
    "customerId": "01a04dad-80da-70aa-8a07-1444e02c719c",
    "serviceTier": "DAWN",
    "address": {
      "line": "서울특별시 강남구 강남대로 396, 101동 1203호",
      "postalCode": "06236",
      "lat": 37.4979,
      "lng": 127.0276,
      "geohash7": "wydm6d6"
    },
    "promisedWindow": {
      "start": "2026-08-30T00:00:00+09:00",
      "end": "2026-08-30T07:00:00+09:00"
    },
    "parcel": {
      "weightG": 1200,
      "volumeCm3": 8000,
      "requiresCold": false,
      "hazmat": false
    },
    "items": [
      { "sku": "SKU-1001", "qty": 2 },
      { "sku": "SKU-2043", "qty": 1 }
    ],
    "placedAt": "2026-08-29T13:20:11.482Z"
  }
}
